{
  "a_restatement": [
    "When an AI agent claims to 'remember' you, it is actually performing a computational loop that combines your query with memory objects retrieved from a datastore, feeding both through a sequence model to generate a response.",
    "These memory objects are created when the model predicts what is worth retaining from interactions, are structured with metadata like timestamps, and are retrieved by scoring against query embeddings using similarity measures such as cosine similarity.",
    "The system addresses agent forgetting through explicit deletion commands, time-based expiration with automatic maintenance cycles, and memory correction over time—described as a concrete architecture rather than marketing language."
  ],
  "b_answers": [
    {
      "answer": "Cached inputs go to the model system, which predicts what is worth remembering and extracts it; storage can also be triggered by explicit user request.",
      "answer_kind": "stated",
      "question_id": "Q1",
      "quoted_span": "A model decides what to store: cached inputs go to the model system, which predicts what is worth remembering and extracts it. It is stored as a memory value in a memory object, and one trigger is you asking the agent to remember your favorite architect.",
      "target_material_id": "M3"
    },
    {
      "answer": "The piece of information is stored as a memory value within a memory object.",
      "answer_kind": "stated",
      "question_id": "Q2",
      "quoted_span": "It is stored as a memory value in a memory object, and one trigger is you asking the agent to remember your favorite architect.",
      "target_material_id": "M16"
    },
    {
      "answer": "The system scores stored memory objects for relevance to the query, compares query embeddings to memory value embeddings using cosine similarity, keeps a top subset, and orders them by timestamp.",
      "answer_kind": "stated",
      "question_id": "Q3",
      "quoted_span": "Instead of rereading your whole history, the agent scores stored memory objects for relevance to your query. It compares a query embedding to memory value embeddings by a measure such as cosine similarity, keeps a top subset, and orders them by timestamp.",
      "target_material_id": "M12"
    },
    {
      "answer": "The specified information is deleted.",
      "answer_kind": "stated",
      "question_id": "Q4",
      "quoted_span": "\"forget that\" deletes the specified information,",
      "target_material_id": "M21"
    },
    {
      "answer": "The system queues the information for deletion, and a maintenance cycle automatically deletes objects past their expiration time.",
      "answer_kind": "stated",
      "question_id": "Q5",
      "quoted_span": "\"forget this after three months\" queues it for deletion. A maintenance cycle deletes objects past their expiration time on its own,",
      "target_material_id": "M23"
    },
    {
      "answer": "The older memory object is replaced or updated; if they are aligned, objects can merge, and if new input contradicts prior values supported by other interactions, they are refined rather than overwritten.",
      "answer_kind": "stated",
      "question_id": "Q6",
      "quoted_span": "Memories are corrected: new timestamped input is matched to the prior memory object it concerns, which is then replaced or updated. Aligned objects can merge, and a value kept with supporting interactions is refined by contradicting input, not overwritten.",
      "target_material_id": "M40"
    },
    {
      "answer": "The problem is that memoryless agents force users to repeatedly re-enter information. This system's approach is different because it uses a memory datastore architecture where query and retrieved memory data flow through a sequence model—an architectural solution rather than marketing language.",
      "answer_kind": "stated",
      "question_id": "Q7",
      "quoted_span": "Agents forget, so you re-enter the same details; the claim is a loop — query plus memory data from a datastore of your past interactions, into a sequence model, out as a response.",
      "target_material_id": "M116"
    }
  ],
  "input_digest": "sha256:e8b0dac840ad174434fd9d5f7979c762a04f389a6a8e599125f85dda1f0c2579",
  "model": {
    "effort": "low",
    "model": "claude-haiku-4-5-20251001",
    "vendor": "anthropic"
  },
  "probe_id": "p1",
  "produced_at": "2026-09-14T01:02:36Z",
  "question_set_digest": "sha256:3f3d920af8f8d9b06de88fd4dc9f0fba7cbe3a30c4a86822560a05279978afaa",
  "schema": "probe-report/v0"
}
