{
  "a_restatement": [
    "A model extracts information worth remembering from user interactions and stores it as memory objects containing values plus metadata such as timestamps and interaction summaries.",
    "When a user queries the agent, the system ranks stored memory objects by relevance to the query using embedding similarity, retrieves a top subset, and orders them by timestamp.",
    "Stored memories can be updated or replaced when new input matches an existing object, and can be deleted immediately on user request or scheduled for deletion after a specified period."
  ],
  "b_answers": [
    {
      "answer": "A model decides what to store by predicting what is worth remembering and extracting it from cached inputs, and one trigger for storing is explicit user request such as asking the agent to remember a favorite architect.",
      "answer_kind": "stated",
      "question_id": "Q1",
      "quoted_span": "A model decides what to store: cached inputs go to the model system, which predicts what is worth remembering and extracts it. It is stored as a memory value in a memory object, and one trigger is you asking the agent to remember your favorite architect.",
      "target_material_id": "M3"
    },
    {
      "answer": "The extracted piece is stored as a memory value within a memory object.",
      "answer_kind": "stated",
      "question_id": "Q2",
      "quoted_span": "It is stored as a memory value in a memory object",
      "target_material_id": "M16"
    },
    {
      "answer": "The agent ranks stored objects by relevance to the query, compares the query embedding to memory value embeddings using a measure such as cosine similarity, keeps a top subset, and orders them by timestamp.",
      "answer_kind": "stated",
      "question_id": "Q3",
      "quoted_span": "At query time the agent does not reread everything; it ranks stored objects by relevance to your query. It compares a query embedding to memory value embeddings by a measure such as cosine similarity, keeps a top subset, and orders them by timestamp.",
      "target_material_id": "M12"
    },
    {
      "answer": "The system deletes the specified information.",
      "answer_kind": "stated",
      "question_id": "Q4",
      "quoted_span": "\"forget that\" deletes the specified information",
      "target_material_id": "M21"
    },
    {
      "answer": "The system queues the information for deletion, and objects past their expiration time are deleted during maintenance.",
      "answer_kind": "stated",
      "question_id": "Q5",
      "quoted_span": "\"forget this after three months\" queues it for deletion. Objects past their expiration time are deleted during maintenance",
      "target_material_id": "M23"
    },
    {
      "answer": "New timestamped input is matched to the prior memory object it concerns, which is then replaced or updated, and aligned objects can be consolidated into one.",
      "answer_kind": "stated",
      "question_id": "Q6",
      "quoted_span": "Memories are corrected: new timestamped input is matched to the prior memory object it concerns, which is then replaced or updated. Aligned objects can be consolidated into one",
      "target_material_id": "M40"
    },
    {
      "answer": "The problem is that agents forget and users must re-enter the same details. The claimed difference is that this system is a structural architecture with memory objects made from interactions, some stored on explicit request, retrieved by relevance, corrected over time, and deleted when requested—not merely a slogan.",
      "answer_kind": "stated",
      "question_id": "Q7",
      "quoted_span": "Agents forget, so you re-enter the same details. What is claimed is structural: memory objects made from your interactions, some on your explicit request, retrieved by relevance, corrected over time, and deleted when you ask. That is a described architecture, not a slogan.",
      "target_material_id": "M116"
    }
  ],
  "input_digest": "sha256:193543d05f0a8fcb7d46903989c606381655f6073796f8d29149f4b1a7264832",
  "model": {
    "effort": "low",
    "model": "claude-haiku-4-5-20251001",
    "vendor": "anthropic"
  },
  "probe_id": "p3",
  "produced_at": "2026-09-13T16:59:39Z",
  "question_set_digest": "sha256:3f3d920af8f8d9b06de88fd4dc9f0fba7cbe3a30c4a86822560a05279978afaa",
  "schema": "probe-report/v0"
}
